{
  "envelope_id": "env.arena_agent_submission_v1",
  "verb": "submit",
  "roles": {
    "submitter": "org:mova-compact",
    "arena_referee": "arena:referee"
  },
  "submission": {
    "submission_id": "sub-001",
    "match_id": "match-2026-02-18-001",
    "task_id": "benchmark_task_001",
    "agent_id": "agent.math-proof.v1",
    "runner_id": "runner-a",
    "agent_contract_ref": "registry://agents/agent.math-proof.v1@1.0.0",
    "task_contract_ref": "registry://tasks/benchmark_task_001@1.0.0",
    "sdk_info": {
      "sdk_name": "mova-arena-sdk",
      "sdk_version": "5.0.0"
    },
    "observability_artifacts": {
      "expanded_ref": "file://runs/run-001/arena.expanded.jsonl",
      "compact_ref": "file://runs/run-001/arena.compact.jsonl"
    },
    "submitted_at": "2026-02-18T12:00:00Z"
  },
  "meta": {
    "source": "arena-ui"
  }
}
